id,name,birth_year,death_year,introduction,biography,contributions,video_1,video_2,image_ext_1,image_ext_2,image_activity,image_intro
12,NGUYỄN HOA THỊNH (1940-2022),,,"là một sĩ quan cao cấp của Quân đội Nhân dân Việt Nam, hàm Trung tướng, nguyên Giám đốc Học viện Kỹ thuật Quân sự, Chủ nhiệm Tổng cục Kỹ thuật, Giám đốc Viện Khoa học và Công nghệ Quân sự. Ngoài ra ông còn từng đảm nhiệm Chủ tịch Hội Cơ học Việt Nam, Chủ tịch Hội đồng quản lý Viện Phát triển công nghệ, truyền thông và hỗ trợ cộng đồng. Ông là chuyên gia trong lĩnh vực cơ học vật rắn biến dạng, cơ học kết cấu và cơ học vật liệu composite.","Sinh năm 1940 mất năm 2022 đồng chí Nguyễn Hoa Thịnh sinh tại thị trấn Ba Đồn huyện quảng trạch tỉnh Quảng Bình(nay là phường Ba Đồn, tỉnh Quảng Trị) Hồi nhỏ, ông là cậu bé thông minh, học giỏi. 
sự nghiệp
Năm 15 tuổi, ông được bố, mẹ đưa ra Hà Nội học tại Trường cấp 2-3 Hà Nội (nay là Trường Trung học phổ thông Việt - Đức, Hà Nội).
Tốt nghiệp cấp 3, năm 1958, Nguyễn Hoa Thịnh thi đỗ vào Khoa Toán, Trường Đại học Tổng hợp Hà Nội. Là một trong những sinh viên xuất sắc, nên Nguyễn Hoa Thịnh được cử sang học tại Đại học Thanh Hoa, một trong những đại học hàng đầu về kỹ thuật của Trung Quốc, tốt nghiệp loại xuất sắc và được trường giữ lại học thêm 1 chuyên đề về biến dạng dẻo kim loại trong vòng 1năm.
sau khi về nước Ông công tác tại Học viện Kỹ thuật Quân sự từ năm 1966, giảng dạy các môn như Sức bền Vật liệu, Cơ học môi trường liên tục, Lý thuyết đàn hồi và Lý thuyết Tấm – Vỏ. 
Năm 1967, ông được kết nạp Đảng Cộng sản Việt Nam
đến 1968 làm Chủ nhiệm Bộ môn Cơ kỹ thuật. 
Năm 1971, ông sang Liên Xô nghiên cứu sinh và bảo vệ luận án phó tiến sĩ (nay là tiến sĩ) chuyên ngành Sức bền Vật liệu và Cơ học kết cấu.
Sau khi về nước, ông đảm nhiệm các chức vụ Phó Chủ nhiệm Khoa, Chủ nhiệm Khoa các Khoa học cơ bản, sang Liên Xô nghiên cứu và bảo vệ thành công luận án Tiến sĩ Khoa học năm 1983–1986. Sau đó, ông lần lượt làm Phó Giám đốc, Giám đốc Học viện Kỹ thuật Quân sự, Phó Chủ nhiệm Kỹ thuật Quân khu 1, Chủ nhiệm Tổng Kỹ thuật, rồi Giám đốc Trung tâm Khoa học và Công nghệ Quân sự.
Ông nghỉ hưu ngày 1/3/2007 và qua đời tại Hà Nội ngày 21/5/2022, hưởng thọ 81 tuổi. Vì những đóng góp xuất sắc cho Đảng, Nhà nước và Quân đội, ông được tặng nhiều huân, huy chương và Huy hiệu 60 năm tuổi Đảng.","Ông Nguyễn Hoa Thịnh là Trung tướng, chuyên gia hàng đầu trong ngành cơ học của Quân đội Nhân dân Việt Nam. Ông có nhiều đóng góp quan trọng trong nghiên cứu cơ bản và phát triển ứng dụng các công nghệ kỹ thuật phục vụ quốc phòng. Cụ thể, ông đã chủ trì và tham gia nhiều đề tài khoa học, kỹ thuật có tính ứng dụng cao, góp phần nâng cao năng lực công nghệ, kỹ thuật cho Quân đội, giúp hiện đại hóa trang bị và bảo đảm kỹ thuật cho các lực lượng vũ trang. Ngoài ra, ông còn thúc đẩy hợp tác nghiên cứu giữa các đơn vị quân sự với các viện, trường để phát triển các lĩnh vực khoa học mới, qua đó góp phần bảo vệ an ninh quốc phòng và phát triển khoa học kỹ thuật quân sự của Việt Nam.",,,,,,
13,LÂM THỊ MỸ DẠ(1949-2023),,,"Lâm Thị Mỹ Dạ là một trong những nhà thơ nữ tiêu biểu của nền thơ Việt Nam hiện đại, được bạn đọc yêu mến nhờ giọng thơ tinh tế, giàu cảm xúc và hình ảnh sống động. Qua các sáng tác của mình, bà không chỉ thể hiện những rung cảm sâu sắc về tình yêu, gia đình, con người và cuộc sống thường nhật, mà còn phản ánh nỗi niềm quê hương, đất nước với sự đồng cảm chân thành. Thơ của Lâm Thị Mỹ Dạ vừa nhẹ nhàng, trữ tình, vừa chứa đựng những suy tư sâu sắc, khiến người đọc dễ dàng đồng cảm và thấm thía. Với những giá trị nghệ thuật và tâm hồn độc đáo ấy, bà đã để lại dấu ấn quan trọng trong văn học Việt Nam hiện đại, góp phần làm giàu đời sống tinh thần và cảm xúc của công chúng.","Lâm Thị Mỹ Dạ (18 tháng 9 năm 1949 – 6 tháng 7 năm 2023) là một cố nhà thơ người Việt Nam.Lâm Thị Mỹ Dạ sinh ngày 18 tháng 9 năm 1949 tại huyện Lệ Thủy, tỉnh Quảng Bình(nay là xã Lệ Thuỷ, tỉnh Quảng Trị)
sự nghiệp: Bà làm việc tại Ty văn hóa Quảng Bình, năm 1978 đến 1983 học Trường viết văn Nguyễn Du. Sau đó bà làm phóng viên, biên tập viên tạp chí Sông Hương (của Hội liên hiệp Văn học nghệ thuật Thừa Thiên-Huế). Lâm Thị Mỹ Dạ là ủy viên Ban chấp hành Hội Văn học Nghệ thuật Thừa Thiên – Huế, hội viên Hội Nhà văn Việt Nam, ủy viên Ban Chấp hành Hội Nhà văn Việt Nam khóa III, ủy viên Hội đồng thơ, Hội Nhà văn Việt Nam khóa V. Chồng bà Hoàng Phủ Ngọc Tường cũng là một nhà văn, nhà thơ có tiếng ở Việt Nam.
Lâm Thị Mỹ Dạ được tặng giải nhất cuộc thi thơ của tuần Báo Văn Nghệ với bài Khoảng trời, hố bom năm 1973 và được giải thưởng văn học của Hội Nhà văn Việt Nam (1981-1983). Năm 2007, nhà thơ Lâm Thị Mỹ Dạ được tặng Giải thưởng Nhà nước về văn học nghệ thuật với ba tập thơ: Trái tim sinh nở, Bài thơ không năm tháng và Đề tặng một giấc mơ...
Bà qua đời lúc 5 giờ sáng ngày 6 tháng 7 năm 2023 tại nhà riêng ở quận Bình Thạnh, TP.HCM sau 14 năm mắc bệnh Alzheimer. Chồng bà cũng qua đời chỉ 18 ngày sau đó. ","Sáng tác thơ trữ tình giàu cảm xúc, phản ánh sâu sắc tình yêu, gia đình, quê hương và con người, với giọng thơ nhẹ nhàng, tinh tế nhưng đầy sức gợi hình ảnh.

Đóng góp cho thơ nữ Việt Nam hiện đại, khẳng định vị thế của người phụ nữ trong nền văn học, mang đến những trải nghiệm cảm xúc khác biệt và sâu sắc.

Phản ánh hiện thực đời sống và tâm hồn con người qua những rung cảm tinh tế, tạo nên sự đồng cảm sâu sắc với độc giả trong và ngoài nước.

Góp phần làm phong phú đời sống văn học Việt Nam, để lại nhiều tác phẩm có giá trị nghệ thuật và nhân văn lâu dài.",https://youtu.be/KAs5PJoP-1c?si=elJg-sTG7rweRdqD,,,,,