id,name,birth_year,death_year,introduction,biography,contributions,video_1,video_2,image_ext_1,image_ext_2,image_activity,image_intro
6,CHẾ LAN VIÊN (1920-1989),,,"Chế Lan Viên là một trong những nhà thơ lớn và tiêu biểu của thi ca Việt Nam hiện đại thế kỷ 20, nổi bật không chỉ với những sáng tác thơ giàu sức gợi, sâu sắc về triết lý và cảm xúc, mà còn là một nhà nghiên cứu lý luận, phê bình văn học nghệ thuật có ảnh hưởng rộng rãi. Từ khi bắt đầu làm thơ ở tuổi rất trẻ, ông đã nhanh chóng khẳng định vị thế trong phong trào Thơ mới và trở thành một trong những đại diện hàng đầu của thế hệ nhà thơ hiện đại Việt Nam. Những tác phẩm của Chế Lan Viên không chỉ phản ánh những trăn trở, suy tư về đời sống, con người và lịch sử, mà còn góp phần làm giàu đời sống tinh thần và mở ra những hướng đi mới cho nền thơ Việt Nam, để lại dấu ấn sâu sắc trong văn học và lòng yêu mến của bạn đọc nhiều thế hệ.","Nhà thơ Chế Lan Viên tên thật là Phan Ngọc Hoan ngày 20 tháng 10 năm 1920 tại xã Thanh An huyện Cam Lộ (nay là xã Hiếu Giang) tỉnh Quảng Trị.Ông lớn lên và theo học ở Quy Nhơn, đỗ bằng Thành chung (THCS hay cấp II hiện nay) thì thôi học, đi dạy tư kiếm sống. Có thể xem Quy Nhơn, Bình Định (nay là tỉnh Gia Lai) là quê hương thứ hai của Chế Lan Viên, nơi đã để lại những dấu ấn sâu sắc trong tâm hồn ông.
sự nghiệp: Chế Lan Viên bắt đầu sáng tác thơ từ năm 12–13 tuổi. Năm 17 tuổi, ông ra mắt tập thơ ""Điêu tàn"" với bút danh Chế Lan Viên, thể hiện nỗi ám ảnh và thương cảm trước sự suy vong của Đế chế Chiêm Thành. Tập thơ đồng thời là tuyên ngôn nghệ thuật của Trường Thơ Loạn, đưa tên tuổi ông trở nên nổi bật trên thi đàn Việt Nam. Chế Lan Viên cùng Hàn Mặc Tử, Yến Lan và Quách Tấn được gọi là “Bàn thành tứ hữu” của Bình Định.
Năm 1939, ông ra học tại Hà Nội. Sau đó Chế Lan Viên vào Sài Gòn làm báo rồi ra Thanh Hóa dạy học. Năm 1942, ông cho ra đời tập văn Vàng sao, tập thơ triết luận về đời với màu sắc siêu hình, huyền bí.
Cách mạng Tháng Tám nổ ra, ông tham gia phong trào Việt Minh tại Quy Nhơn, rồi ra Huế tham gia Đoàn xây dựng cùng với Hoài Thanh, Lưu Trọng Lư, Đào Duy Anh. Thời kỳ này, Chế Lan Viên viết bài và làm biên tập cho các báo Quyết thắng, Cứu quốc, Kháng chiến. Phong cách thơ của ông giai đoạn này cũng chuyển dần về trường phái hiện thực. Tháng 7 năm 1949, trong chiến dịch Tà Cơn-đường 9 (Quảng Trị), Chế Lan Viên gia nhập Đảng Cộng sản Đông Dương.
Năm 1954, Chế Lan Viên tập kết ra Bắc làm biên tập viên báo Văn học. Từ năm 1956 đến năm 1958, ông công tác ở phòng văn nghệ, Ban tuyên huấn trung ương và đến cuối năm 1958 trở lại làm biên tập tuần báo Văn học (sau là báo Văn nghệ). Từ năm 1963 ông là ủy viên thường vụ Hội nhà văn Việt Nam, ủy viên ban thư ký Hội nhà văn Việt Nam. Ông cũng là đại biểu Quốc hội Việt Nam Dân chủ Cộng hòa các khóa IV, V và VI, ủy viên Ban văn hóa - giáo dục của quốc hội.
Sau 1975, ông vào sống tại Thành phố Hồ Chí Minh. Ông mất ngày 19 tháng 6 năm 1989 (tức ngày 16 tháng 5 năm Kỷ Tỵ) tại Bệnh viện Thống Nhất, Thành phố Hồ Chí Minh, thọ 68 tuổi.
Ông được nhà nước Việt Nam truy tặng Giải thưởng Hồ Chí Minh về Văn học nghệ thuật (1996)","Chế Lan Viên là tác giả của hơn 30 tác phẩm thơ, văn xuôi và tiểu luận, trong đó Điêu tàn gây tiếng vang lớn nhờ phong cách siêu thực, huyền bí và nỗi hoài cảm về văn hóa Champa. Là một “kiện tướng” của phong trào Thơ mới, ông góp phần đưa thi ca Việt Nam bước vào hiện đại với những sáng tạo mạnh mẽ về hình thức và tư tưởng. Trong kháng chiến, thơ ông chuyển sang giọng hiện thực – chính luận, hào hùng và giàu cảm hứng đất nước, tạo dấu ấn nổi bật trong thơ chống Mỹ. Bên cạnh sáng tác, Chế Lan Viên còn làm báo, hoạt động văn hóa, giữ vai trò Ủy viên Thường vụ Hội Nhà văn Việt Nam, đại biểu Quốc hội nhiều khóa và đóng góp lớn cho phê bình – nghiên cứu văn học Việt Nam hiện đại.",https://youtu.be/2r6E0711Zco?si=USOo1Hyjw0SMbfa_,https://youtu.be/rYGXC1UZjSw?si=7-HsVA1PIPkh-SD6,,,,
7,ĐOÀN KHUÊ (1923-1999),,,"Ðại tướng Ðoàn Khuê là nhà chính trị, quân sự xuất sắc của Ðảng, Quân đội ta. Ông đã có nhiều cống hiến cho sự nghiệp giải phóng dân tộc, xây dựng và bảo vệ Tổ quốc.
Suốt chặng đường 60 năm hoạt động cách mạng (1939-1999), trong đó có hơn 40 năm gắn bó với sự nghiệp đấu tranh giải phóng dân tộc và làm nghĩa vụ quốc tế cao cả, Đại tướng Đoàn Khuê luôn đem hết tinh thần, nghị lực và trí tuệ cống hiến cho Đảng, cho nhân dân, đặt lợi ích của cách mạng, của nhân dân lên trên hết. Đồng hành với những bước phát triển của đất nước, sự trưởng thành của quân đội, đồng chí đã nêu tấm gương sáng về phẩm chất của người cán bộ cách mạng, phẩm chất cao đẹp “Bộ đội Cụ Hồ”, nhà lãnh đạo uy tín, người chỉ huy xuất sắc của Quân đội nhân dân Việt Nam.","Đại tướng Đoàn Khuê, bí danh là Võ Tiến Trình, sinh ngày 29 – 10 – 1923 ở làng Gia Đẳng, xã Triệu Tân, huyện Triệu Phong (nay là xã Nam Cửa Việt), tỉnh Quảng Trị, trong một gia đình giàu lòng yêu nước, có truyền thống đấu tranh cách mạng.
cuộc đời  sự nghiệp
Ông tham gia cách mạng từ những năm 1940, hoạt động xây dựng cơ sở cách mạng ở Quảng Bình(cũ) và gia nhập Đảng Cộng sản Đông Dương năm 1945, làm Chủ nhiệm Mặt trận Việt Minh tỉnh Quảng Bình(cũ). Trong kháng chiến chống Mỹ, Đoàn Khuê giữ nhiều chức vụ quan trọng tại Quân khu 5 như Phó Chính ủy, Phó Bí thư Quân khu ủy, góp phần đưa Quân khu 5 trở thành địa phương ""đi đầu diệt Mỹ"". Ông chỉ đạo nhiều chiến dịch quân sự quan trọng, xây dựng thế trận chiến tranh nhân dân vững chắc.
Sau khi miền Nam giải phóng, từ năm 1977 ông làm Tư lệnh kiêm Chính ủy Quân khu 5, chỉ đạo giải quyết vấn đề FULRO và tham gia giúp nhân dân Campuchia lật đổ chế độ diệt chủng Pol Pot, đồng thời chỉ huy Quân tình nguyện Việt Nam trong chiến dịch giải phóng Campuchia.
Từ năm 1983 đến 1986, ông làm Phó Tư lệnh kiêm Tham mưu trưởng Bộ Tư lệnh 719, chỉ huy và hỗ trợ quân tình nguyện Việt Nam tại Campuchia. Từ năm 1986 đến 1998, ông được Đảng và Nhà nước giao giữ các trọng trách như Tổng Tham mưu trưởng Quân đội Nhân dân Việt Nam, Thứ trưởng Bộ Quốc phòng, Ủy viên Thường vụ Quân ủy Trung ương và Bộ trưởng Bộ Quốc phòng.
Đồng chí Đoàn Khuê được thăng quân hàm Thiếu tướng (1974), Trung tướng (1980), Thượng tướng (1984) và Đại tướng (1990); là Ủy viên Ban Chấp hành Trung ương Đảng khoá IV, V, VI, VII, VIII; Ủy viên Bộ Chính trị khoá VI, VII, VIII; Đại biểu Quốc hội khoá VII, VIII, IX, X.
Đại tướng Đoàn Khuê từ trần ngày 16/1/1999, tại Hà Nội.","Kháng chiến giải phóng dân tộc: Ông tham gia xây dựng cơ sở cách mạng ở Quảng Bình, chỉ huy giành chính quyền Đồng Hới (1945) và lãnh đạo nhiều chiến dịch quan trọng chống Pháp, nổi bật ở An Khê, Măng Đen, Chư Đrếch. Trong kháng chiến chống Mỹ, ông chỉ đạo công tác chính trị, tư tưởng và tác chiến tại Quân khu 5, góp phần vào các chiến dịch Mậu Thân 1968 và giải phóng Đà Nẵng 1975.
Xây dựng CNXH và quân đội: Sau thống nhất, giữ cương vị Tư lệnh kiêm Chính ủy Quân khu 5, ông tổ chức phòng thủ, đào tạo cán bộ dân tộc thiểu số, chỉ huy lực lượng giúp Campuchia, góp phần xây dựng quân đội cách mạng, chính quy, tinh nhuệ và từng bước hiện đại.
 Nghĩa vụ quốc tế: Từ 1983–1987, là Phó Tư lệnh, Tham mưu trưởng Bộ Tư lệnh 719, ông chỉ đạo Chiến dịch A4 tiêu diệt căn cứ Pol Pot, xây dựng tuyến phòng thủ K5, bảo vệ thành quả cách mạng Campuchia và đảm bảo lực lượng Việt Nam rút quân an toàn.",https://youtu.be/pCQEiElntGQ?si=YBquNBldeRX4Cwp5,https://youtu.be/bt0Ip_g9fZ0?si=z1BlAAq0fmzgovfr,,,,
8,TRẦN TRỌNG TÂN (1926-2014),,,"Trần Trọng Tân là nguyên Trưởng Ban Tư tưởng - Văn hóa Trung ương (nay là Ban Tuyên giáo Trung ương), Bí thư Tỉnh ủy Quảng Trị và Phó Bí thư Thành ủy Thành phố Hồ Chí Minh.
Ông được đánh giá là nhà lý luận xuất sắc, một người cộng sản trung kiên với hơn 70 năm hoạt động cách mạng, tiêu biểu trong công tác tư tưởng, văn hóa và xây dựng Đảng. Trần Trọng Tân đã góp phần quan trọng trong việc phát triển tư tưởng cách mạng và dẫn dắt các phong trào cách mạng trong cả nước","Đồng chí Trần Trọng Tân tên thật là Trần Trọng Hoãn, sinh ngày 15/10/1926, thôn Tân Mỹ, xã Cam Thành, huyện Cam Lộ(nay là xã Cam Lộ), tỉnh Quảng Trị. Thừa hưởng truyền thống yêu nước của quê hương, gia đình.                                                                                                                                                                                       sự nghiệp: ông tham gia cách mạng từ rất sớm và đứng vào hàng ngũ của Đảng khi mới 20 tuổi.
 Năm 24 tuổi (1950), ông được bầu làm Bí thư Tỉnh ủy Quảng Trị(cũ). Từ năm 1955 - 1959, ông tham gia công tác tuyên huấn của Đảng. Năm 1961, ông được phân công làm Ủy viên Thường trực Ban Tuyên huấn Trung ương Cục miền Nam. Năm 1967, ông được cử hoạt động bí mật ở Sài Gòn với nhiệm vụ Phó ban Tuyên huấn Khu ủy Sài Gòn - Gia Định, Bí thư Đảng ủy cánh Tuyên huấn nội thành, Bí thư Ban Cán sự văn nghệ sĩ, Bí thư Ban Cán sự báo chí ký giả nội thành. Năm 1969, ông địch bắt giam, sau đó đày ra Côn Đảo, đến tháng 6/1975, sau khi trở về, ông được phân công làm Trưởng ban Tuyên huấn Thành ủy TPHCM. Năm 1980, ông được điều động tham gia công tác giúp bạn và là Ủy viên Ban lãnh đạo Đoàn chuyên gia Việt Nam (1980 - 1986), có lúc làm Bí thư Đảng ủy Đoàn chuyên gia ở Campuchia. Đến năm 1986, ông được bầu vào Ban Chấp hành Trung ương và được cử giữ chức Trưởng ban Tư tưởng - Văn hóa Trung ương. Năm 1991, ông được điều động về TPHCM, giữ nhiệm vụ Phó Bí thư Thành ủy, Trưởng ban Tư tưởng - Văn hóa Thành ủy cho đến lúc nghỉ hưu năm 1997. Sau khi nghỉ hưu, ông vẫn tiếp tục giúp Thành ủy một số vấn đề về công tác tư tưởng của Đảng bộ. Ông từ trần ngày 4/8/2014 tại TPHCM","Đóng góp của ông Trần Trọng Tân bao gồm vai trò quan trọng trong công tác xây dựng Đảng, tuyên giáo, tư tưởng và lý luận Ông góp phần làm sáng tỏ nền tảng tư tưởng của Đảng, tập hợp biên tập xuất bản bộ Hồ Chí Minh toàn tập, phát triển lý luận về con đường đi lên chủ nghĩa xã hội của Việt Nam lấy thực tiễn làm thước đo, với nhiều năm hoạt động cách mạng, tham gia Hội đồng Lý luận Trung ương, đóng góp vào sự phát triển của Cương lĩnh, Điều lệ Đảng và các văn kiện Đại hội Đảng. góp phần xây dựng lòng tin của đảng viên và nhân dân
 Ông còn tích cực đề xuất giải pháp đấu tranh phòng, chống tham nhũng, suy thoái tư tưởng và đạo đức của cán bộ, đảng viên. ",,,,,,
9,NGUYỄN THỊ CẨM THẠNH (1927-2022),,,"Nổi bật không chỉ là nhà văn nữ đầu tiên của Quảng Bình mà còn là người dấn thân vào cách mạng và hoạt động văn hóa – xã hội. Bà để lại dấu ấn sâu sắc qua các tiểu thuyết, truyện ngắn và ký, phản ánh đời sống con người, đặc biệt là phụ nữ và cộng đồng ngư dân vùng biển. Đồng thời, bà cũng đảm nhận nhiều vị trí quan trọng trong Hội Nhà văn Việt Nam và đại biểu Quốc hội, góp phần làm phong phú đời sống văn học và xã hội Việt Nam","tiểu sử
 Bà sinh năm 1927, quê làng Lý Hòa, xã Hải Phú, huyện Bố Trạch tỉnh Quảng Bình(nay là xã Đông Trạch, tỉnh Quảng Trị). Lý Hòa là một làng ven biển thuộc vùng Bắc Trung Bộ Việt Nam, nổi tiếng với truyền thống văn hóa lâu đời và gắn bó với nghề nông, nghề biển. Quê hương này chịu ảnh hưởng sâu sắc của lịch sử và thiên nhiên, với những đầm phá, sông suối và biển cả, tạo nên bối cảnh sống phong phú và giàu cảm xúc mà về sau trở thành nguồn cảm hứng cho nhiều tác phẩm của bà.
sự nghiệp: 14 tuổi bà đã tham gia cách mạng, hoạt động bí mật, là Bí thư Tỉnh hội Phụ nữ cứu quốc đầu tiên của Quảng Bình(cũ), sau đó là lãnh đạo Hội Phụ nữ Liên khu 4, Hội Liên hiệp Phụ nữ Trung ương và Hà Nội, rồi làm biên tập Nhà xuất bản Kim Đồng và Báo Văn học. bà vào Hội Nhà văn Việt Nam năm 1957. Bà từng là Ủy viên Ban Chấp hành Hội Nhà văn Việt Nam, Ủy viên Ban Phụ trách tuần Báo Văn Nghệ trong nhiều năm.
Song hành với công tác lãnh đạo, quản lý là việc sáng tác văn học không ngừng nghỉ, tính đến nay, nhà văn Nguyễn Thị Cẩm Thạnh đã xuất bản 5 cuốn tiểu thuyết và truyện vừa, 7 tập truyện ngắn và ký. Trong đó có truyện ngắn Bên ni bên tê (Giải thưởng của Hội Văn nghệ Liên khu Việt Bắc-1949), truyện ngắn Những đứa em (Giải thưởng của báo Văn học-1962), tiểu thuyết Âm vang biển sóng (Tặng thưởng của Ủy ban toàn quốc Liên hiệp các Hội Văn học-Nghệ thuật Việt Nam-1999).
Bà đã được Hôi Nhà văn Việt Nam tặng Giải thưởng cống hiến; Trung ương Hội Liên hiệp Phụ nữ Việt Nam tặng bằng khen về thành tích xuất sắc đóng góp cho phong trào phụ nữ bằng sáng tạo văn học nghệ thuật.","Nguyễn Thị Cẩm Thạnh là nhà văn nữ đầu tiên của Quảng Bình, góp phần quan trọng khai phá và phát triển văn học địa phương. Bà được biết đến với những tác phẩm viết về đời sống, con người Quảng Bình, mang hơi thở chân thật và sâu sắc về tâm hồn, lịch sử vùng đất quê hương. Cống hiến của bà không chỉ nằm ở giá trị nghệ thuật mà còn là sự ghi nhận vai trò của người phụ nữ trong văn học Việt Nam hiện đại, đặc biệt là đại diện cho văn học tỉnh lẻ, góp phần đưa tiếng nói của vùng quê ra với cộng đồng rộng lớn hơn.",,,,,,
10,TRẦN HOÀN (1928-2003),,,"là một trong những nhạc sĩ tiêu biểu của nền âm nhạc cách mạng Việt Nam, đồng thời là nhà quản lý văn hóa, chính trị gia có ảnh hưởng sâu rộng. Ông không chỉ sáng tác nhiều ca khúc nổi tiếng, ghi dấu ấn trong hai cuộc kháng chiến và thời kỳ xây dựng đất nước, mà còn đảm nhận nhiều vị trí quan trọng trong ngành văn hóa – thông tin và các tổ chức văn học nghệ thuật. Cuộc đời và sự nghiệp của Trần Hoàn gắn liền với sự phát triển của âm nhạc cách mạng và nền văn hóa Việt Nam hiện đại.","TIỂU SỬ
Ông Trần Hoàn (tên thật Nguyễn Tăng Hích) sinh ngày 27 tháng 12 năm 1928 tại xã Hải Phong, huyện Hải Lăng (nay là xã Nam Hải Lăng), tỉnh Quảng Trị. Bố ông rất yêu âm nhạc và hiểu biết sâu sắc về ca Huế, hát bội và nhạc Tây. Năm 1941, ông theo học tại Lycée Khải Định (nay là Quốc học Huế), tập chơi mandolin, guitar Tây Ban Nha và Hawaiene, học nhạc và tham gia dàn nhạc nhà trường.
sự nghiệp
Ở tuổi 17, ông tham gia cách mạng, sáng tác bài hát đầu tay ""Học sinh vui tươi"" và đoạt giải thưởng âm nhạc tại Huế. Trong chiến tranh Đông Dương, ông công tác tại Đoàn Tuyên truyền Liên khu III và IV. Năm 1946, ông sáng tác ca khúc ""Hồn nước"" và gửi đến Hồ Chí Minh khi dự Hội nghị Fontainebleau. Năm 1948, khi 20 tuổi, ông được kết nạp Đảng Cộng sản Việt Nam tại chiến khu Quảng Bình. Ông sáng tác ""Sơn nữ ca"" và ""Lời người ra đi"" cùng thời kỳ này, tuy bị cấm lưu hành trong vùng kháng chiến vì bị xem là ""lãng mạn tiểu tư sản"", nhưng được các nhạc sĩ Nguyễn Xuân Khoát và Văn Cao đánh giá cao.
Sau chiến tranh Đông Dương kết thúc, ông được bổ nhiệm làm Giám đốc Sở Văn hóa – Thông tin Hải Phòng, công tác tại đây 10 năm và sáng tác nhạc phẩm ""Kể chuyện người cộng sản"" và ""Xin mời anh chị về thăm Hải Phòng"". Cuối những năm 1960, trong chiến tranh Việt Nam, ông vào chiến trường Trị Thiên với bút danh Hồ Thuận An, mang tên cửa biển quê hương, sáng tác các bài ""Tiếng hát trên Gio Cam giải phóng"" và ""Lời ru trên nương"". Bài ""Lời ru trên nương"" phổ nhạc từ thơ Nguyễn Khoa Điềm.
Sau năm 1975, ông giữ các chức vụ quan trọng trong ngành văn hóa và chính quyền, từ trưởng Ty Thông tin Văn hóa Bình Trị Thiên, giám đốc Sở Văn hóa – Thông tin, đến Trưởng ban Tuyên huấn và Khoa giáo Bình Trị Thiên, Phó Bí thư Thành ủy Hà Nội, Bộ trưởng Bộ Thông tin, Bộ trưởng Bộ Văn hóa Thông tin, Ủy viên Ban Chấp hành Trung ương Đảng, đại biểu Quốc hội. Ông cũng là Chủ tịch Ủy ban toàn quốc Liên hiệp các hội văn học nghệ thuật Việt Nam, Ủy viên Hội đồng Lý luận phê bình văn học nghệ thuật Trung ương. Trước khi mất năm 2003, ông là Chủ tịch Hội đồng cố vấn nghệ thuật cho SEA Games 22 tổ chức tại Việt Nam","Sáng tác nhiều ca khúc cách mạng nổi tiếng, góp phần cổ vũ tinh thần chiến đấu và xây dựng đất nước, như Hồn nước, Sơn nữ ca, Lời người ra đi, Kể chuyện người cộng sản, Tiếng hát trên Gio Cam giải phóng, Lời ru trên nương, và Một mùa xuân nho nhỏ.Gắn bó lâu dài với hoạt động văn hóa cách mạng, công tác tại Đoàn Tuyên truyền Liên khu, Sở Văn hóa – Thông tin Hải Phòng, Trị – Thiên và nhiều cơ quan văn hóa khác.
Giữ nhiều chức vụ lãnh đạo quan trọng trong ngành văn hóa – thông tin và chính quyền: Bộ trưởng Bộ Thông tin, Bộ trưởng Bộ Văn hóa Thông tin, Phó Bí thư Thành ủy Hà Nội, Ủy viên Ban Chấp hành Trung ương Đảng, Đại biểu Quốc hội.
Đóng góp vào đào tạo và phát triển văn học – nghệ thuật, làm Chủ tịch Ủy ban toàn quốc Liên hiệp các hội văn học nghệ thuật Việt Nam và Ủy viên Hội đồng Lý luận phê bình văn học nghệ thuật Trung ương.
Góp phần bảo tồn và phát huy giá trị văn hóa Việt Nam, để lại nhiều tác phẩm có giá trị lịch sử, văn hóa và giáo dục lâu dài.
",https://youtu.be/euJ55F-GJtE?si=w1Sz-qIYegZy6FrI,https://youtu.be/d5u05NiHumg?si=uP0aYopr7TehRAuQ,,,,
11,MAI XUÂN VĨNH (1931),,,"Được mệnh danh là ""Vị tướng Biển đảo"", Mai Xuân Vĩnh được xem là một trong những vị tướng xuất sắc nhất của Hải quân Việt Nam.Đến thời bình, Phó Đô đốc Mai Xuân Vĩnh vẫn luôn là một đảng viên mẫu mực, một vị tướng giản dị, trung hậu, hết lòng phụng sự cho Đảng, cho nhân dân và cho Tổ quốc. Ông là một tấm gương sáng ngời về đạo đức cách mạng, lòng trung dũng và ý chí kiên cường . Với vai trò là người đứng đầu trong số 33 tác giả của công trình nghiên cứu chiến đấu bảo vệ quần đảo Trường Sa, ông được trao tặng giải thưởng Hồ Chí Minh về Khoa học Công nghệ","tiểu sử
Mai Xuân Vĩnh sinh ngày 15 tháng 4 năm 1931 và lớn lên tại làng Thọ Linh, xã Quảng Sơn, huyện Quảng Trạch nay thuộc thị xã Ba Đồn, tỉnh Quảng Bình(nay là phường Ba Đồn, tỉnh Quảng Trị). Ông là chắt nội của Lãnh binh Mai Lượng, lãnh tụ khởi nghĩa phong trào Cần Vương chống Pháp vào cuối thế kỷ 19 ở vùng hữu ngạn sông Gianh - Quảng Bình.
sự nghiệp
Từ tháng 01/1947 đến tháng 04/1950: Ông là Đội viên Đội thiếu niên cứu quốc, giáo viên Bình dân học vụ tại xã Quảng Sơn, huyện Quảng Trạch, tỉnh Quảng Bình(cũ).Ngày 02/09/1950: Ông được kết nạp vào Đảng Cộng sản Đông Dương.
 năm 1950 ông nhập ngũ biên chế tại đại đội 88 tiểu đoàn 436 trung đoàn 18 cuối năm 1951 tiểu đoàn 436 tách khỏi trung đoàn 18 cuối năm 1951 tiểu đoàn 436 tách khỏi trung đoàn 18 sát nhập với trung đoàn 101 ở Thừa Thiên đầu năm 1960 ông được cử đi học tại Trường Sĩ quan Hải quân Kirov ở thủ đô Baku,
Ông công tác tại Quân chủng Hải quân từ tháng 2/1965 đến khi nghỉ hưu tháng 3/2000, trải qua nhiều chức vụ quan trọng từ Trợ lý chiến khu, Tiểu đoàn trưởng Tiểu đoàn 8 Radar, Cựu đoàn trưởng Sông Xanh, Phó Chỉ huy trưởng Khu vực 4 Sông Gianh, Phó Phòng Tác chiến, Phó Tham mưu trưởng, Phó Tư lệnh – Tham mưu trưởng, đến Tư lệnh Quân chủng Hải quân. Trong kháng chiến chống Mỹ, ông chỉ huy Tiểu đoàn 8 giữ vững trận địa, chỉ thị mục tiêu cho các lực lượng tàu chiến, góp phần quan trọng vào thắng lợi của Hải quân nhân dân Việt Nam và quân khu 4, đặc biệt trong giai đoạn chiến tranh leo thang 1966–1968. Ông 2 lần được bầu là chiến sĩ thi đua toàn quân và năm 2007 được Chủ tịch nước phong tặng Anh hùng Lực lượng vũ trang nhân dân.
Trong kháng chiến chống Mỹ, ông chỉ huy tiểu đoàn giữ vững trận địa, chỉ thị mục tiêu chính xác cho các lực lượng tàu chiến, góp phần làm nên thắng lợi của Hải quân Nhân dân Việt Nam và Quân khu 4 giai đoạn 1966–1968. Ông hai lần được bầu là Chiến sĩ Thi đua toàn quân và ngày 18/2/2007 được Chủ tịch nước truy tặng danh hiệu Anh hùng Lực lượng vũ trang nhân dân vì những cống hiến xuất sắc.","Ông Mai Xuân Vĩnh là Phó Đô đốc Hải quân nhân dân Việt Nam, nguyên Tư lệnh Quân chủng Hải quân từ 1993 đến 2000. Ông có nhiều cống hiến xuất sắc trong kháng chiến chống Mỹ, giữ vững trận địa ra-đa bờ biển, chỉ thị mục tiêu cho không quân và tàu chiến, góp phần giành thắng lợi lớn. Trên cương vị Tư lệnh Hải quân, ông đã tham mưu cho Quân ủy Trung ương và Bộ Quốc phòng xây dựng thế trận phòng thủ biển đảo, bảo vệ vững chắc chủ quyền biển đảo, đặc biệt là quần đảo Trường Sa và nhà giàn DK1. Ông được phong tặng danh hiệu Anh hùng Lực lượng vũ trang nhân dân vì những đóng góp quan trọng cho đất nước ",https://youtu.be/Fln3KpvFSXA?si=KYAxlpFHWzBy-PX9,https://youtu.be/7e8VH700NcY?si=fdKE1KvGEeEzDs1g,,,,
